https://udn.com/news/story/7321/6764318,中興電工,被告、判刑、罰金、沒收,詐欺、詐騙、不法所得,中興電工涉雲豹甲車弊案，去年底審結，董事長江義福遭刑6年6月，併科罰金4050萬，犯罪所得20億餘元沒收，全案上訴二審，今天開庭時，江對法官喊冤，一審認定有嚴重違誤，審理過程，也沒有充分答辯機會，任職中興電工27年，「身心已融入公司，不會做傷害公司行為」。
https://www.ettoday.net/news/20221202/2393097.htm,偉多利食品,起訴、緩起訴、不起訴,貪污、商業會計法、偽造文書,台北市士林區天玉里里長潘錦雄涉嫌貪汙遭起訴，他自2016到2021年來涉嫌浮報里民建設經費、收賄，貪污39萬餘元。士林地檢署偵結後，將潘錦雄依貪污等罪起訴，其餘9名公司負責人犯商業會計法、賄賂罪分別獲緩起訴、不起訴。
https://www.ettoday.net/news/20221202/2393097.htm,林阿三企業,起訴,貪污,台北市士林區天玉里里長潘錦雄涉嫌貪汙遭起訴，他自2016到2021年來涉嫌浮報里民建設經費、收賄，貪污39萬餘元。士林地檢署偵結後，將潘錦雄依貪污等罪起訴，其餘9名公司負責人犯商業會計法、賄賂罪分別獲緩起訴、不起訴。
https://www.ettoday.net/news/20221202/2393097.htm,春發禮儀社,起訴,貪污,台北市士林區天玉里里長潘錦雄涉嫌貪汙遭起訴，他自2016到2021年來涉嫌浮報里民建設經費、收賄，貪污39萬餘元。士林地檢署偵結後，將潘錦雄依貪污等罪起訴，其餘9名公司負責人犯商業會計法、賄賂罪分別獲緩起訴、不起訴。
https://www.ettoday.net/news/20221202/2393097.htm,金洋禮品,起訴、緩起訴、不起訴,貪污、商業會計法、偽造文書,士林區天玉里里長潘錦雄涉嫌貪汙遭起訴，他涉嫌浮報里民建設經費、收賄，貪污39萬餘元。士林地檢署將潘錦雄依貪污等罪起訴，其餘9名公司負責人犯商業會計法、賄賂罪分別獲緩起訴、不起訴。
https://udn.com/news/story/7321/6747888,李孟儒,無罪,貪污收賄,署立前新竹醫院醫師李孟儒涉集體貪污收賄案，法院無法認定有貪污對價關係判決無罪確定。李男因本案遭羈押46天而聲請刑事補償，高院日前判決每天新台幣5000元、共補償23萬元。全案源於行政院衛生署署立醫院系統於民國100年爆發大規模貪瀆案，檢調多次搜索約談，桃園地檢署偵結起訴48名官商，包括前衛生署醫管會執行長黃焜璋與7名署醫正副院長，後因管轄權之分，分由不同法院審理。其中，最高法院108年、110年陸續判前衛生署醫管會執行長黃焜璋15年徒刑、前基隆醫院心臟科醫師林繼敏14年徒刑、前基隆醫院院長李源芳8年徒刑定讞。前新竹醫院醫師兼放射線科主任李孟儒涉案部分，案經一審依貪污治罪條例的不違背職務收受賄賂罪，判刑9年，經上訴，二審改判無罪，經最高法院撤銷發回，高院更一審判無罪後，再經最高法院撤銷發回，高院更二審判決無罪，全案確定。更二審判決指出，無法證明李孟儒收賄新台幣120萬元；至於廠商在儀器運轉後，按月交付的提撥合作拆帳款46萬524元部分，是廠商按月對醫院執行相關合作案的捐助，並非歸由李個人取得，難認此部分回饋金與李職務上行為之間有對價關係，或有何收受賄賂的不法犯意。李孟儒以本案遭羈押46天為由，向法院聲請刑事補償；台灣高等法院受理後，合議庭認為李男遭羈押時擔任執業醫師，具有相當社經地位，因羈押而遭當時任職的台大新竹分院予以停職，迄至他停止羈押後才復職，他除受有精神上痛苦、名譽減損外，經濟上也同受較高程度損失，決定以每天最高額度5000元計算，准予補償23萬元。不服可向司法院刑事補償法庭提出聲請覆審。
https://www.ettoday.net/news/20221202/2393097.htm,均昶實業,起訴,貪污,士林區天玉里里長潘錦雄涉嫌貪汙遭起訴，他涉嫌浮報里民建設經費、收賄，貪污39萬餘元。士林地檢署將潘錦雄依貪污等罪起訴，其餘9名公司負責人犯商業會計法、賄賂罪分別獲緩起訴、不起訴。
https://www.ettoday.net/news/20221202/2393097.htm,偉家工程,起訴,貪污,台北市士林區天玉里里長潘錦雄涉嫌貪汙遭起訴，他自2016到2021年來涉嫌浮報里民建設經費、收賄，貪污39萬餘元。士林地檢署偵結後，將潘錦雄依貪污等罪起訴，其餘9名公司負責人犯商業會計法、賄賂罪分別獲緩起訴、不起訴。
https://www.ettoday.net/news/20221202/2393097.htm,「榮耀造景」,起訴,貪污,士林區天玉里里長潘錦雄涉嫌貪汙遭起訴，被控浮報里民建設經費、收賄，貪污39萬餘元。士林地檢署將潘錦雄依貪污等罪起訴，其餘9名公司負責人犯商業會計法、賄賂罪分別獲緩起訴、不起訴。
https://www.ettoday.net/news/20221121/2384954.htm,夏世紘,起訴,違反銀行法,藝人夏于喬的父親夏世紘因協助新加坡來台的富南斯集團在台發展，涉嫌違反銀行法，被台北地檢署起訴。夏世紘被判2年4月徒刑。富南斯集團涉嫌以虛擬貨幣吸金，受害者提告詐欺。集團人頭負責人朱禹豪被認定無實際參與吸金行為，不起訴。
https://udn.com/news/story/7321/6747888,前新竹醫院,無罪確定,貪污收賄,署立前新竹醫院醫師李孟儒涉集體貪污收賄案，法院無法認定有貪污對價關係判決無罪確定。李男因本案遭羈押46天而聲請刑事補償，高院日前判決每天新台幣5000元、共補償23萬元。全案源於行政院衛生署署立醫院系統於民國100年爆發大規模貪瀆案，檢調多次搜索約談，桃園地檢署偵結起訴48名官商，包括前衛生署醫管會執行長黃焜璋與7名署醫正副院長，後因管轄權之分，分由不同法院審理。其中，最高法院108年、110年陸續判前衛生署醫管會執行長黃焜璋15年徒刑、前基隆醫院心臟科醫師林繼敏14年徒刑、前基隆醫院院長李源芳8年徒刑定讞。前新竹醫院醫師兼放射線科主任李孟儒涉案部分，案經一審依貪污治罪條例的不違背職務收受賄賂罪，判刑9年，經上訴，二審改判無罪，經最高法院撤銷發回，高院更一審判無罪後，再經最高法院撤銷發回，高院更二審判決無罪，全案確定。更二審判決指出，無法證明李孟儒收賄新台幣120萬元；至於廠商在儀器運轉後，按月交付的提撥合作拆帳款46萬524元部分，是廠商按月對醫院執行相關合作案的捐助，並非歸由李個人取得，難認此部分回饋金與李職務上行為之間有對價關係，或有何收受賄賂的不法犯意。李孟儒以本案遭羈押46天為由，向法院聲請刑事補償；台灣高等法院受理後，合議庭認為李男遭羈押時擔任執業醫師，具有相當社經地位，因羈押而遭當時任職的台大新竹分院予以停職，迄至他停止羈押後才復職，他除受有精神上痛苦、名譽減損外，經濟上也同受較高程度損失，決定以每天最高額度5000元計算，准予補償23萬元。不服可向司法院刑事補償法庭提出聲請覆審。
https://www.ettoday.net/news/20221121/2384954.htm,富南斯集團,起訴、判刑,違反銀行法,藝人夏于喬的父親夏世紘因協助富南斯集團在台發展，被起訴違反銀行法，並被判刑2年4月徒刑。富南斯集團涉嫌以虛擬貨幣吸金，詐騙2000多名會員超過30億元，投資者血本無歸。投資受害者對集團人頭負責人朱禹豪提告詐欺，但地檢署認為查無朱男實際參與集團運作，處不起訴處分。
https://udn.com/news/story/7321/6669027,廖泰宇,判刑,非法經營銀行業務且犯罪財物1億元以上之罪,泰旺企管顧問公司董事長廖泰宇因非法經營銀行業務且犯罪財物1億元以上之罪被判刑10年定讞。
https://www.ettoday.net/news/20221109/2376379.htm,蔡男,控告、欠債、詐欺,未出庭、跑路,室內兒童樂園「騎士堡」負責人蔡男被指控欠債千萬跑路，總公司人去樓空，受害者總計債務恐上千萬。蔡男從2月起透過友人向投訴人林男借了5、600萬元，但支票跳票後蔡男消失至今。林男已對蔡男提告詐欺。
https://udn.com/news/story/7321/6669027,泰旺企管顧問公司,判刑、定讞,非法經營銀行業務且犯罪財物1億元以上之罪,泰旺企管顧問公司董事長廖泰宇因非法經營銀行業務且犯罪財物1億元以上之罪被判刑10年定讞。
https://www.ettoday.net/news/20221109/2376379.htm,騎士堡,控告、欠債、詐欺,跑路、債務,室內兒童樂園「騎士堡」近日傳出財務出狀況，台中、高雄店在10月底收攤。一名林姓民眾指控，騎士堡蔡姓負責人向他借5、600萬，卻支票跳票，從9月底消失至今，還有其他受害者，總計債務恐上千萬，總公司人去樓空，蔡男遭債權人控告後也未出庭，懷疑他早就跑到國外。
https://udn.com/news/story/7321/6669027,洪雅蕙,判刑2年，宣告緩刑5年,加入「以太世界」投資方案，鼓吹教友和民眾當下線,洪雅蕙加入「以太世界」投資方案，鼓吹教友和民眾當下線，判刑2年，宣告緩刑5年。
https://udn.com/news/story/7321/6669027,永約教會,判刑、緩刑、沒收,非法經營銀行業務、犯罪財物1億元以上,泰旺企管顧問公司董事長廖泰宇因非法經營銀行業務且犯罪財物1億元以上之罪被判10年定讞，永約教會女牧師洪雅蕙因加入「以太世界」投資方案被判2年，宣告緩刑5年。
https://udn.com/news/story/7321/6669027,陳力心,判刑2年,沒收9萬美元確定,泰旺企管顧問公司董事長廖泰宇因非法經營銀行業務且犯罪財物1億元以上之罪，判刑10年定讞。永約教會女牧師洪雅蕙因加入「以太世界」投資方案，判刑2年，宣告緩刑5年。陳力心因從事外匯業務，判刑2年，沒收9萬美元確定。
https://udn.com/news/story/7321/6669027,泰旺企管顧問公司董事長廖泰宇、永約教會女牧師洪雅蕙,判刑、緩刑、沒收,非法經營銀行業務、吸金、詐欺,泰旺企管顧問公司董事長廖泰宇因非法經營銀行業務且犯罪財物1億元以上之罪被判10年定讞。永約教會女牧師洪雅蕙因加入「以太世界」投資方案並鼓吹教友和民眾當下線被判刑2年，宣告緩刑5年。
https://udn.com/news/story/7321/6626205,許姓男子-資承、元太、誠太、旭富、旭富、元太,起訴、詐欺、偽造文書,提起公訴,許姓男子與張姓女友在高雄等地，設立「資承」、「元太」、「誠太」、「旭富」等管理顧問公司，涉嫌徵業務員當投資「介紹人」，以授課方式，招攬投資人購買未上市股票，許、張卻在騙到近2億元後捲款潛逃，令投資人血本無歸。高雄地檢署今天依詐欺、偽造文書等罪嫌提起公訴。
https://udn.com/news/story/7321/6610932,吳岱霖,起訴,詐欺罪,中鋼、中油、台電等國營「鐵飯碗」再爆電子舞弊，男子吳岱霖為首的舞弊集團，5年幫101人作弊捧到鐵飯碗，獲利至少上億元；其中郭姓、林姓集團成員，就是靠吳男協助，順利考上台電與中鋼，林被集團吸收後當起講師，傳授作弊技巧給後進，還拉來妻子一起賺，高雄地檢署偵結，今依詐欺罪起訴吳男等5人。
https://udn.com/news/story/7321/6610932,中鋼,起訴,詐欺罪,中鋼、中油、台電等國營「鐵飯碗」再爆電子舞弊，男子吳岱霖為首的舞弊集團，5年幫101人作弊捧到鐵飯碗，獲利至少上億元；其中郭姓、林姓集團成員，就是靠吳男協助，順利考上台電與中鋼，林被集團吸收後當起講師，傳授作弊技巧給後進，還拉來妻子一起賺，高雄地檢署偵結，今依詐欺罪起訴吳男等5人。
https://udn.com/news/story/7321/6610932,中油,起訴,詐欺罪,中鋼、中油、台電等國營「鐵飯碗」再爆電子舞弊，男子吳岱霖為首的舞弊集團，5年幫101人作弊捧到鐵飯碗，獲利至少上億元；其中郭姓、林姓集團成員，就是靠吳男協助，順利考上台電與中鋼，林被集團吸收後當起講師，傳授作弊技巧給後進，還拉來妻子一起賺，高雄地檢署偵結，今依詐欺罪起訴吳男等5人。
https://udn.com/news/story/7321/6610932,台電,起訴,詐欺罪,台電再爆電子舞弊案，男子吳岱霖為首的舞弊集團，5年幫101人作弊捧到鐵飯碗，獲利至少上億元；其中郭姓、林姓集團成員，就是靠吳男協助，順利考上台電與中鋼，林被集團吸收後當起講師，傳授作弊技巧給後進，還拉來妻子一起賺，高雄地檢署偵結，今依詐欺罪起訴吳男等5人。
https://udn.com/news/story/7321/6610932,郭姓,起訴,詐欺罪,中鋼、中油、台電等國營「鐵飯碗」再爆電子舞弊，男子吳岱霖為首的舞弊集團，5年幫101人作弊捧到鐵飯碗，獲利至少上億元；其中郭姓、林姓集團成員，就是靠吳男協助，順利考上台電與中鋼，林被集團吸收後當起講師，傳授作弊技巧給後進，還拉來妻子一起賺，高雄地檢署偵結，今依詐欺罪起訴吳男等5人。
https://udn.com/news/story/7321/6610932,林姓,起訴,詐欺罪,中鋼、中油、台電等國營「鐵飯碗」再爆電子舞弊，男子吳岱霖為首的舞弊集團，5年幫101人作弊捧到鐵飯碗，獲利至少上億元；其中郭姓、林姓集團成員，就是靠吳男協助，順利考上台電與中鋼，林被集團吸收後當起講師，傳授作弊技巧給後進，還拉來妻子一起賺，高雄地檢署偵結，今依詐欺罪起訴吳男等5人。
https://udn.com/news/story/123270/6877524,,,,
https://udn.com/news/story/7321/6593812,楊燕山-行政院農業委員會水土保持局台中分局,被告、判刑,貪污,行政院農業委員會水土保持局台中分局秘書楊燕山、治理課課長林勇州等五人，涉集體接受業者喝花酒、性招待，被台中地方法院判刑。楊判二年十月，林判九年六月，另三人獲緩刑。
https://udn.com/news/story/123270/6877524,劉滄梧,搜索、交保,內線交易,調查局搜索約談了基亞公司董座張世忠等十八人，其中包括劉滄梧和妻子施庭芳。檢方依違反證交法命張世忠交保，施庭芳則交了十萬元保釋金。劉滄梧涉嫌內線交易，也被約談並交保。整個案件涉及高端內線交易和基亞非常規交易兩部分偵辦。
https://udn.com/news/story/7321/6593812,林勇州-行政院農業委員會水土保持局台中分局,被告、判刑,貪污、收賄,行政院農業委員會水土保持局台中分局秘書楊燕山、治理課課長林勇州等五人，涉集體接受業者喝花酒、性招待，廠商還成立ＬＩＮＥ群組邀約；林因不認罪，被台中地方法院重判九年六月，楊判二年十月，另三人獲緩刑，可上訴。
https://udn.com/news/story/123270/6877524,中華民國癌症醫學會,搜索、提審、交保,內線交易,調查局搜索約談基亞董座張世忠等十八人，張世忠等人坦承有內線交易，檢方依違反證交法命張世忠卅萬元交保，其胞妹張姿玲及丈夫黃子亮各五十萬元交保。高端至少涉及五至八起內線弊端，跨年後恐有第二波偵辦行動。
https://udn.com/news/story/123270/6877524,劉滄梧,搜索、交保,內線交易,調查局搜索約談了基亞公司董座張世忠等十八人，其中包括劉滄梧和妻子施庭芳。張世忠等人坦承有內線交易，檢方依違反證交法命張世忠交保。劉滄梧被約談後請回，施庭芳十萬元交保。整個案件涉及高端內線交易和基亞非常規交易兩部分偵辦。
https://udn.com/news/story/7321/6593812,林永欣-乾坤技術顧問有限公司,起訴、被告、控告、指控、罪嫌、搜索、提審、交保、扣押、收押、羈押、禁見、判刑、判決、改判無罪、不起訴、緩起訴,貪污、賄賂、收賄,行政院農業委員會水土保持局台中分局秘書楊燕山、治理課課長林勇州等五人，二○一九年辦理十八件總款項九千多萬元工程，涉集體接受業者喝花酒、性招待，廠商還成立ＬＩＮＥ群組邀約；林因不認罪，被台中地方法院重判九年六月，楊判二年十月，另三人獲緩刑，可上訴。
https://udn.com/news/story/7321/6580338,胡亦嘉,起訴,特別背信等罪,街口金融科技董事長胡亦嘉涉嫌在追募「期街口布蘭特正2」ETF基金時配售不公，獨厚身旁熟人，藉此自肥約6000萬元。台北地檢署依證交法特別背信等罪起訴胡亦嘉、胡妻莊郁琳、親信詹淑玲，以及街口投信前董事長王律傑、董事陳志睿，和地產商楊健一之子楊立偉共6人。
https://udn.com/news/story/123270/6877524,基亞董座張世忠、張姿玲、黃子亮、劉滄梧、施庭芳、陳燦堅、王信雄、歐朝銓,搜索、交保,內線交易、非常規交易,調查局搜索基亞董座張世忠等人，涉嫌內線交易和非常規交易。張世忠等人坦承有內線交易，檢方依違反證交法命張世忠卅萬元交保，張姿玲及黃子亮各五十萬元交保。高端至少涉及五至八起內線弊端，跨年後恐有第二波偵辦行動。劉滄梧和施庭芳也被約談，施十萬元交保。陳燦堅的好友王信雄五萬元交保，歐朝銓以十萬元交保。
https://udn.com/news/story/7321/6580338,街口金融科技,起訴,特別背信等罪,街口金融科技董事長胡亦嘉涉嫌在追募「期街口布蘭特正2」ETF基金時配售不公，獨厚身旁熟人，藉此自肥約6000萬元。台北地檢署依證交法特別背信等罪起訴胡亦嘉、胡妻莊郁琳、親信詹淑玲，以及街口投信前董事長王律傑、董事陳志睿，和地產商楊健一之子楊立偉共6人。
https://udn.com/news/story/123270/6877524,劉滄梧,搜索、交保,內線交易,調查局搜索約談了基亞公司董座張世忠等十八人，其中包括劉滄梧和妻子施庭芳。張世忠等人坦承有內線交易，檢方依違反證交法命張世忠交保。劉滄梧被約談後請回，施庭芳十萬元交保。高端內線交易涉及五至八起弊端，跨年後可能有第二波偵辦行動。
https://udn.com/news/story/123270/6877524,食藥署罕見疾病及藥物審議委員會,搜索、提審、交保,內線交易,調查局搜索約談基亞董座張世忠等十八人，張世忠等人坦承有內線交易，檢方依違反證交法命張世忠卅萬元交保，其胞妹張姿玲及丈夫黃子亮各五十萬元交保。高端至少涉及五至八起內線弊端，跨年後恐有第二波偵辦行動。
https://udn.com/news/story/123270/6877524,張姿玲,搜索、交保,內線交易,調查局搜索約談基亞董座張世忠等十八人，張世忠等人坦承有內線交易，檢方依違反證交法命張世忠卅萬元交保，張姿玲及丈夫黃子亮各五十萬元交保。高端至少涉及五至八起內線弊端，跨年後恐有第二波偵辦行動。
https://udn.com/news/story/123270/6877524,高端,搜索、交保,內線交易,調查局偵辦高端內線交易案、母公司基亞非常規交易案，前天搜索約談基亞董座張世忠共十八人到案，士林地檢署漏夜偵訊後，張世忠等人坦承有內線交易，檢方昨天清晨依違反證交法命張世忠卅萬元交保，其胞妹張姿玲（基亞董事）及丈夫黃子亮（統創建設總裁）各五十萬元交保；調查發現，高端至少涉及五至八起內線弊端，跨年後恐有第二波偵辦行動。
https://udn.com/news/story/123270/6877524,張姿玲,搜索、交保,內線交易,調查局搜索約談基亞董座張世忠等十八人，張世忠等人坦承有內線交易，檢方依違反證交法命張世忠卅萬元交保，張姿玲及丈夫黃子亮各五十萬元交保。高端至少涉及五至八起內線弊端，跨年後恐有第二波偵辦行動。
https://udn.com/news/story/7321/6510662,李泰龍-富士康集團、日立光、星合科技,判李九年，公司處罰金一億一千萬元,加重非法經營收受存款業務銀行業務罪,台灣最大廣告電視牆公司「富士康集團」惡性倒閉，檢調查出負責人李泰龍旗下三公司用五花八門廣告標吸引投資客，保證年利率最高三成，吸金七億五千多萬元，後收購金礦咖啡也倒閉；法院以李為情勢所逼才自首不予減刑，依銀行法判他九年，公司處罰金一億一千萬元。檢方調查，李泰龍身兼富士康、日立光及星合三間公司負責人，李從二○一五年起對外招攬投資，以廣告設備、鑫電視ＬＥＤ電視牆、多媒體廣告機ＲＴＶ、室內外屏、餐飲連鎖、土地買賣，蛋糕券等做標的物。李對內部業務員也訂定職務晉升、抽佣制度，通路開發部設主任至副總階級，各可抽百分之五至十三佣金；投資客簽約後，集團保證可獲年利率百分之五至百分之卅紅利，前後吸金七億五六五四萬多元。李泰龍二○一九年收購金礦咖啡改名士達衛咖啡，但經營不善二○二○年十一月資金出現缺口，李對內謊稱十二月就能損益平衡，繼續要員工招攬投資業務吸金，直到同年十二月九日債台高築，前金補不齊後金，自行到台中地檢署自首。法院指出，富士康集團非國內銀行，不得從事視同收受存款工作，國內金融機構當時一年定期存款利率百分之一點三七至零點八四，富士康卻打出年利率百分之五至卅，以優厚報酬吸引投資客罔顧風險。法院審酌，李泰龍雖自首符合「得」減刑要件，但根據他在ＬＩＮＥ群組公告稱士達衛咖啡全面閉店消息，員工紛紛質疑「事前完全沒說」、「您還隱瞞了什麼」等，可預見發不出員工薪水、負債恐遭法律追訴才自首，不予以減刑。依加重非法經營收受存款業務銀行業務罪判李九年，另富士康、日立光及星合科技，三公司共罰金一億一千萬元。
https://udn.com/news/story/123270/6877524,高端,搜索、交保,內線交易,調查局偵辦高端內線交易案、母公司基亞非常規交易案，前天搜索約談基亞董座張世忠共十八人到案，士林地檢署漏夜偵訊後，張世忠等人坦承有內線交易，檢方昨天清晨依違反證交法命張世忠卅萬元交保，其胞妹張姿玲（基亞董事）及丈夫黃子亮（統創建設總裁）各五十萬元交保；調查發現，高端至少涉及五至八起內線弊端，跨年後恐有第二波偵辦行動。
https://udn.com/news/story/7321/6496284,陳枝章,起訴,貪汙罪嫌起訴,台灣中油前勞工董事陳枝章涉與中油煉製事業部經理張子房在五件標案中向廖姓廠商索賄，各得手百餘萬元；檢方起訴指出，陳枝章曾任中油工會推派勞工董事，負責中油提交的採購預算來源、履約期程、廠商資格、招決標方式等職，去年八月退休；張任職中油煉製部修護組經理，負責各類重大採購案招標前審議採購內容，兩人具法定職務權限的「授權公務員」。
https://udn.com/news/story/123270/6877524,張姿玲,搜索、交保,內線交易,調查局搜索約談基亞董座張世忠等十八人，張世忠等人坦承有內線交易，檢方依違反證交法命張世忠卅萬元交保，張姿玲及丈夫黃子亮各五十萬元交保。高端至少涉及五至八起內線弊端，跨年後恐有第二波偵辦行動。
https://udn.com/news/story/7321/6496284,台灣中油,起訴,貪汙罪嫌起訴,台灣中油前勞工董事陳枝章涉與中油煉製事業部經理張子房在五件標案中向廖姓廠商索賄，各得手百餘萬元；陳枝章被檢方起訴，移審地院，裁定20萬交保，限制住居，且每周需到派出所報到。
https://udn.com/news/story/123270/6877524,高端,搜索、交保,內線交易,調查局偵辦高端內線交易案、母公司基亞非常規交易案，前天搜索約談基亞董座張世忠共十八人到案，士林地檢署漏夜偵訊後，張世忠等人坦承有內線交易，檢方昨天清晨依違反證交法命張世忠卅萬元交保，其胞妹張姿玲（基亞董事）及丈夫黃子亮（統創建設總裁）各五十萬元交保；調查發現，高端至少涉及五至八起內線弊端，跨年後恐有第二波偵辦行動。
https://udn.com/news/story/7321/6496284,張子房,起訴,貪汙罪嫌起訴,台灣中油前勞工董事陳枝章涉與中油煉製事業部經理張子房在五件標案中向廖姓廠商索賄，各得手百餘萬元；檢方起訴指出，陳枝章收賄一一五萬元，張子房收賄一五五萬元，檢方偵結，將陳依涉犯職務上行為收受賄賂三罪、張涉貪汙罪五罪起訴。
https://udn.com/news/story/123270/6877524,張姿玲,搜索、交保,內線交易,調查局搜索約談基亞董座張世忠等十八人，張世忠等人坦承有內線交易，檢方依違反證交法命張世忠卅萬元交保，張姿玲及丈夫黃子亮各五十萬元交保。高端至少涉及五至八起內線弊端，跨年後恐有第二波偵辦行動。
